{
  "ir_version": 1,
  "spec_version": "0.11.0",
  "source_fingerprint": "ad2932d4e695be1dc335ccc970c233dbcd44c5f341240cdb83834b5443aae512",
  "scope": {
    "mode": "pilot",
    "documents": [
      "docs/rules/agent-delegation-and-coordination.md",
      "docs/rules/global-contracts.md",
      "docs/rules/human-agent-collaboration.md",
      "docs/workflows/main/05-development-execution/01-ready-task-scheduling.md",
      "docs/workflows/main/05-development-execution/02-autonomous-implementation-and-closure.md",
      "docs/workflows/main/05-development-execution/03-verification-and-exception-convergence.md",
      "docs/workflows/main/05-development-execution/04-state-commit-and-continuous-progression.md"
    ]
  },
  "clauses": [
    {"id":"SC-GLOBAL-001","kind":"invariant","source":[{"document":"docs/rules/global-contracts.md","anchor":"## Tailoring｜流程裁剪"}],"must":["Tailoring depth may vary by risk, but requirement/scope/acceptance correctness, traceability, blocking open items and gates, risk-matched verification/evidence, authority boundaries, required human collaboration, deviation correction, and Git-fixed Task Commit/code_ref remain preserved."]},
    {"id":"SC-GLOBAL-002","kind":"authority","source":[{"document":"docs/rules/global-contracts.md","anchor":"## Human / Agent Authority｜人机决策权限"}],"must":["Requirement semantics, In/Out Scope, core business rules, Acceptance Criteria semantic changes, Accepted Deviation, risk acceptance, and mandatory-gate waivers remain Human Decision matters."]},
    {"id":"SC-HAC-001","kind":"trigger","source":[{"document":"docs/rules/human-agent-collaboration.md","anchor":"## 3. Sync Triggers｜认知同步触发"}],"when":["A Shared Model, Meaningful Model Delta, Decision Boundary, Authority Escalation, Shared Model Invalidated, or Major Closure trigger occurs."],"must":["Synchronize only the decision-relevant cognitive delta before the dependent Human decision."],"relations":[{"type":"before","target":"SC-HAC-002"}]},
    {"id":"SC-HAC-002","kind":"gate","source":[{"document":"docs/rules/human-agent-collaboration.md","anchor":"## 5. Decision Readiness｜决策就绪"}],"when":["An important Confirm, Human Decision, or Human Acceptance is about to occur."],"must":["Ensure Human has the minimum sufficient goal, current model, delta/finding, evidence, options/consequences when real alternatives exist, recommendation, and remaining uncertainty before requesting the decision."]},
    {"id":"SC-ADC-001","kind":"authority","source":[{"document":"docs/rules/agent-delegation-and-coordination.md","anchor":"### Authority Boundary｜权限边界"}],"must":["Main Agent retains global coherence and final accountability."],"must_not":["Subagent independently changes Requirement, Acceptance Criteria, Scope, fixed Design Decision, Formal Task Goal/Boundary/Coverage/Verification/Done, Workflow State, Accepted Deviation, or risk acceptance."]},
    {"id":"SC-ADC-002","kind":"invariant","source":[{"document":"docs/rules/agent-delegation-and-coordination.md","anchor":"### Context & Coordination｜上下文与协调"}],"must":["At any one shared mutable boundary, allow only one Worker owner at a time."]},
    {"id":"SC-DEV-001","kind":"gate","source":[{"document":"docs/workflows/main/05-development-execution/01-ready-task-scheduling.md","anchor":"## 1.2 筛选可执行任务"}],"when":["Task Status is Ready."],"must":["Derive Runnable only when dependencies are satisfied, no valid blocker exists, and the required execution environment is available."],"must_not":["Persist Runnable, Queued, or Scheduled as Task states."]},
    {"id":"SC-DEV-002","kind":"transition","source":[{"document":"docs/workflows/main/05-development-execution/01-ready-task-scheduling.md","anchor":"## 1.5 认领并启动任务"}],"when":["Task is Runnable and its Execution Unit is ready."],"must":["Claim the Task and transition Ready → In Progress before Worker execution."],"relations":[{"type":"before","target":"SC-DEV-003"}]},
    {"id":"SC-DEV-003","kind":"authority","source":[{"document":"docs/workflows/main/05-development-execution/02-autonomous-implementation-and-closure.md","anchor":"## 2.3 自治实现与运行探索"}],"must":["Worker may choose implementation strategy and local repair within the Task Contract."],"must_not":["Worker silently changes Requirement/Acceptance Criteria, fixed Design Decision, Task Goal/Boundary/Coverage, or Verification Contract."]},
    {"id":"SC-DEV-004","kind":"gate","source":[{"document":"docs/workflows/main/05-development-execution/02-autonomous-implementation-and-closure.md","anchor":"## 2.5 Task Commit 与送验证收敛"}],"when":["Necessary Local Verification has passed and a Git-fixed change exists."],"must":["Create a scoped Task Commit with stable code_ref before entering formal Verification."],"relations":[{"type":"before","target":"SC-VER-001"}]},
    {"id":"SC-DEV-005","kind":"artifact","source":[{"document":"docs/workflows/main/05-development-execution/02-autonomous-implementation-and-closure.md","anchor":"## 2.6 产物"}],"must":["Verification-ready Result records Task, Requirement, actual changes, achieved result, local evidence, code_ref when Git-fixed change exists, and only relevant verification notes."],"must_not":["Treat Task Commit as Task Done, Requirement Integration, Merge, Release, or deployment."]},
    {"id":"SC-VER-001","kind":"gate","source":[{"document":"docs/workflows/main/05-development-execution/03-verification-and-exception-convergence.md","anchor":"## 3.3 执行独立验证与质量门禁"}],"must":["Run deterministic Gate first against the actual verification object and exact code_ref when one exists."],"must_not":["Treat Worker self-verification as formal proof."],"relations":[{"type":"before","target":"SC-VER-002"}]},
    {"id":"SC-VER-002","kind":"gate","source":[{"document":"docs/workflows/main/05-development-execution/03-verification-and-exception-convergence.md","anchor":"## 3.3 执行独立验证与质量门禁"}],"when":["Complex semantic/quality/UX questions or high-risk changes need independent reasoning beyond deterministic Gate."],"must":["Use a fresh Reviewer with context isolated from Worker where practical and sufficient capability for the review."],"must_not":["Let Reviewer replace deterministic Gate or default to repairing the implementation."],"relations":[{"type":"isolated_from","target":"SC-DEV-003"}]},
    {"id":"SC-VER-003","kind":"routing","source":[{"document":"docs/workflows/main/05-development-execution/03-verification-and-exception-convergence.md","anchor":"## 3.4 归因失败并分流异常"}],"when":["A formal failure cannot be reliably attributed, needs cross-layer localization, or evidence cannot identify the earliest failed layer."],"must":["Enter Debug & Defect Resolution instead of guessing."]},
    {"id":"SC-VER-004","kind":"transition","source":[{"document":"docs/workflows/main/05-development-execution/03-verification-and-exception-convergence.md","anchor":"## 3.5 形成验证结论"}],"must":["Map passed → Done, repair_required → In Progress, and blocked → Blocked as the target Task status."],"relations":[{"type":"before","target":"SC-STATE-001"}]},
    {"id":"SC-STATE-001","kind":"transition","source":[{"document":"docs/workflows/main/05-development-execution/04-state-commit-and-continuous-progression.md","anchor":"## 4.3 提交任务状态"}],"must":["Write the Verification verdict to the authoritative Task state and preserve confirmed Result/Evidence/code_ref or Blocker facts."],"must_not":["Persist Worker logs, intermediate reasoning, or short-lived Agent/Model/Workspace metadata as Task facts."]},
    {"id":"SC-STATE-002","kind":"gate","source":[{"document":"docs/workflows/main/05-development-execution/04-state-commit-and-continuous-progression.md","anchor":"## 4.5 Requirement 级集成与 Push"}],"when":["All TasksOf(REQ-xx) are Done."],"must":["Perform Requirement Integration, then Requirement AC Gate, and only after it passes perform Requirement Push."],"must_not":["Treat Requirement Push as Merge, Release, Deploy, or Stage 6 final Verified."]}
  ]
}
